<?xml version="1.0" encoding="UTF-8"?>
<?xml-stylesheet type="text/css" href="Zadanie2.css"?>


<xd:Main
    xmlns:xd="http://www.xD.com/WarhammerRepo"
    xmlns:xn="http://www.xD.com/Author"
    xmlns:xsi="http://www.w3.org/2001/XMLSchema-instance"
    xsi:schemaLocation="http://www.xD.com/WarhammerRepo WarhammerRepo.xsd"
>
<xd:author>
    <xn:title>Author</xn:title>
    <xn:name>Jakub</xn:name>
    <xn:surname>Kalinowski</xn:surname>
    <xn:index>242413</xn:index>
</xd:author>
<xd:warhammerRepo>
    <xd:army>
        <xd:armyData>
            <xd:name>Ultramarines</xd:name>
            <xd:allegiance>Loyal</xd:allegiance>
            <xd:description>UwU</xd:description>
        </xd:armyData>
        <xd:unit>
            <xd:unitData compulsory="true">
                <xd:name>Tactical Squad Alpha</xd:name>
                <xd:movement>6.5</xd:movement>
                <xd:WS>4</xd:WS>
                <xd:BS>4</xd:BS>
                <xd:S>4</xd:S>
                <xd:T>4</xd:T>
                <xd:Ld>8</xd:Ld>
                <xd:Save>3</xd:Save>
                <xd:pointCost>100</xd:pointCost>
                <xd:role>Troops</xd:role>
            </xd:unitData>
            <xd:miniature>
                <xd:name>Alpha1</xd:name>
                <xd:assemblyDate>2022-02-12</xd:assemblyDate>
                <xd:paintDate>2022-02-12</xd:paintDate>
            </xd:miniature>
            <xd:miniature>
                <xd:name>Alpha2</xd:name>
                <xd:assemblyDate>2022-02-12</xd:assemblyDate>
                <xd:paintDate>2022-02-12</xd:paintDate>
            </xd:miniature>
            <xd:miniature>
                <xd:name>Alpha3</xd:name>
                <xd:assemblyDate>2022-02-12</xd:assemblyDate>
                <xd:paintDate>2022-02-12</xd:paintDate>
            </xd:miniature>
            <xd:miniature>
                <xd:name>Alpha4</xd:name>
                <xd:assemblyDate>2022-02-12</xd:assemblyDate>
                <xd:paintDate>2022-02-12</xd:paintDate>
            </xd:miniature>
            <xd:miniature>
                <xd:name>Alpha5</xd:name>
                <xd:assemblyDate>2022-02-12</xd:assemblyDate>
                <xd:paintDate>2022-02-12</xd:paintDate>
            </xd:miniature>
            <xd:miniature>
                <xd:name>Alpha6</xd:name>
                <xd:assemblyDate>2022-02-12</xd:assemblyDate>
                <xd:paintDate>2022-02-12</xd:paintDate>
            </xd:miniature>
            <xd:miniature>
                <xd:name>Alpha7</xd:name>
                <xd:assemblyDate>2022-02-12</xd:assemblyDate>
                <xd:paintDate>2022-02-12</xd:paintDate>
            </xd:miniature>
            <xd:miniature>
                <xd:name>Alpha8</xd:name>
                <xd:assemblyDate>2022-02-12</xd:assemblyDate>
                <xd:paintDate>2022-02-12</xd:paintDate>
            </xd:miniature>
            <xd:miniature>
                <xd:name>Alpha9</xd:name>
                <xd:assemblyDate>2022-02-12</xd:assemblyDate>
                <xd:paintDate>2022-02-12</xd:paintDate>
            </xd:miniature>
            <xd:miniature>
                <xd:name>Alpha10</xd:name>
                <xd:assemblyDate>2022-02-12</xd:assemblyDate>
                <xd:paintDate>2022-02-12</xd:paintDate>
            </xd:miniature>
        </xd:unit>
        <xd:unit>
            <xd:unitData compulsory="false">
                <xd:name>Tactical Squad Beta</xd:name>
                <xd:movement>6.5</xd:movement>
                <xd:WS>4</xd:WS>
                <xd:BS>4</xd:BS>
                <xd:S>4</xd:S>
                <xd:T>4</xd:T>
                <xd:Ld>8</xd:Ld>
                <xd:Save>3</xd:Save>
                <xd:pointCost>100</xd:pointCost>
                <xd:role>Troops</xd:role>
            </xd:unitData>
            <xd:miniature>
                <xd:name>Beta1</xd:name>
                <xd:assemblyDate>2022-02-12</xd:assemblyDate>
                <xd:paintDate>2022-02-12</xd:paintDate>
            </xd:miniature>
            <xd:miniature>
                <xd:name>Beta2</xd:name>
                <xd:assemblyDate>2022-02-12</xd:assemblyDate>
                <xd:paintDate>2022-02-12</xd:paintDate>
            </xd:miniature>
            <xd:miniature>
                <xd:name>Beta3</xd:name>
                <xd:assemblyDate>2022-02-12</xd:assemblyDate>
                <xd:paintDate>2022-02-12</xd:paintDate>
            </xd:miniature>
            <xd:miniature>
                <xd:name>Beta4</xd:name>
                <xd:assemblyDate>2022-02-12</xd:assemblyDate>
                <xd:paintDate>2022-02-12</xd:paintDate>
            </xd:miniature>
            <xd:miniature>
                <xd:name>Beta5</xd:name>
                <xd:assemblyDate>2022-02-12</xd:assemblyDate>
                <xd:paintDate>2022-02-12</xd:paintDate>
            </xd:miniature>
            <xd:miniature>
                <xd:name>Beta6</xd:name>
                <xd:assemblyDate>2022-02-12</xd:assemblyDate>
                <xd:paintDate>2022-02-12</xd:paintDate>
            </xd:miniature>
            <xd:miniature>
                <xd:name>Beta7</xd:name>
                <xd:assemblyDate>2022-02-12</xd:assemblyDate>
                <xd:paintDate>2022-02-12</xd:paintDate>
            </xd:miniature>
            <xd:miniature>
                <xd:name>Beta8</xd:name>
                <xd:assemblyDate>2022-02-12</xd:assemblyDate>
                <xd:paintDate>2022-02-12</xd:paintDate>
            </xd:miniature>
            <xd:miniature>
                <xd:name>Beta9</xd:name>
                <xd:assemblyDate>2022-02-12</xd:assemblyDate>
                <xd:paintDate>2022-02-12</xd:paintDate>
            </xd:miniature>
            <xd:miniature>
                <xd:name>Beta10</xd:name>
                <xd:assemblyDate>2022-02-12</xd:assemblyDate>
                <xd:paintDate>2022-02-12</xd:paintDate>
            </xd:miniature>
        </xd:unit>
    </xd:army>
</xd:warhammerRepo>
</xd:Main>